{
  "artifact_type": "checkpoint_scope_state",
  "chain_scope": "project:00000000-0000-0000-0000-000000000001",
  "checkpoint_id": "22222222-3333-4444-5555-666666666666",
  "commitment_profile": "keel.scope_state.merkle.v1",
  "predicate_basis": {
    "canonicalization_profile": "keel.canonical_json.payload.v1",
    "reserved_namespaces": [
      "keel.scope_predicate.reserved.v1"
    ],
    "supported_predicate_kinds": [
      "project_id",
      "permit_id",
      "request_id",
      "event_type",
      "category",
      "severity",
      "decision_type",
      "policy_id",
      "provider",
      "sequence_number",
      "created_at",
      "occurred_at",
      "section",
      "export_type"
    ]
  },
  "predicate_grammar_version": "keel.scope_predicate.v1",
  "scope_commitments": [
    {
      "first_matching_sequence": 3,
      "last_matching_sequence": 6,
      "matching_count": 4,
      "membership_root_hash": "sha256:0d3d57afdf888c3e4f032f42eacbd5784195c08948e819379561c04e16b8974a",
      "predicate_value": {
        "equals": {},
        "operator": "and",
        "ranges": {
          "created_at": {
            "gte": "2026-05-19T10:00:03.000000Z",
            "lt": "2026-05-19T10:00:07.000000Z"
          }
        },
        "version": "keel.scope_predicate.v1"
      },
      "predicate_value_hash": "sha256:0b9bf65ec0ed95babab859b831ecdf504e67a562b74b9b627666745bdeb73869"
    }
  ],
  "scope_state_id": "keel.scope_state.v1:35612394ae89957223f13fe8cf637283e3d592001e7e503cd08aeb35ebbceb6a:22222222-3333-4444-5555-666666666666",
  "signature": {
    "algorithm": "Ed25519",
    "key_id": "sha256:1325b850c2871916eae203f0efc3c898",
    "signature": "ed25519:n8NzIsE0AzBw6qjjqGjC6nO9D+736fvJWd3PV/nEfI6RwFHLjZRrkOAYWRA9Hs5uot332w1WGFah6vGlvxCoAA=="
  },
  "signed_at": "2026-05-19T12:00:00Z",
  "tree_size": 8,
  "trust_root_reference": {
    "key_id": "sha256:1325b850c2871916eae203f0efc3c898",
    "manifest_version": "keel.public_key_manifest.v1",
    "purpose": "scope_state"
  },
  "version": "checkpoint_scope_state.v1"
}
