{
  "artifact_type": "checkpoint_scope_state",
  "chain_scope": "project:00000000-0000-0000-0000-000000000001",
  "checkpoint_id": "22222222-3333-4444-5555-666666666666",
  "commitment_profile": "keel.scope_state.merkle.v1",
  "predicate_basis": {
    "canonicalization_profile": "keel.canonical_json.payload.v1",
    "reserved_namespaces": [
      "keel.scope_predicate.reserved.v1"
    ],
    "supported_predicate_kinds": [
      "project_id",
      "permit_id",
      "request_id",
      "event_type",
      "category",
      "severity",
      "decision_type",
      "policy_id",
      "provider",
      "sequence_number",
      "created_at",
      "occurred_at",
      "section",
      "export_type"
    ]
  },
  "predicate_grammar_version": "keel.scope_predicate.v1",
  "scope_commitments": [
    {
      "first_matching_sequence": 1,
      "last_matching_sequence": 4,
      "matching_count": 2,
      "membership_root_hash": "sha256:02762992d2dc20693cf962de8d4d6220bf7fddccb2d10982b8fbdcdf7509545a",
      "predicate_value": {
        "equals": {
          "event_type": "permit.created"
        },
        "operator": "and",
        "ranges": {},
        "version": "keel.scope_predicate.v1"
      },
      "predicate_value_hash": "sha256:597adebd612c12474c9999e282d169fa7a2008792cd8e0a12ca91e5cd9e0a50f"
    }
  ],
  "scope_state_id": "keel.scope_state.v1:35612394ae89957223f13fe8cf637283e3d592001e7e503cd08aeb35ebbceb6a:22222222-3333-4444-5555-666666666666",
  "signature": {
    "algorithm": "Ed25519",
    "key_id": "sha256:1325b850c2871916eae203f0efc3c898",
    "signature": "ed25519:VHG54HI0wcnUsgHaQKO6mwgQv2vmDETeNt6sS5jVDdkpiKfQxUKwACGpgMceHt8s1fQlATdB/febVXFZm4KEBg=="
  },
  "signed_at": "2026-05-19T12:00:00Z",
  "tree_size": 8,
  "trust_root_reference": {
    "key_id": "sha256:1325b850c2871916eae203f0efc3c898",
    "manifest_version": "keel.public_key_manifest.v1",
    "purpose": "scope_state"
  },
  "version": "checkpoint_scope_state.v1"
}
